{
  "goal": "Wave 9 ui-job \u2014 analyze wait page is resume_hint; complete Open catalog run / Read CIO cover as .btn",
  "non_goals": [
    "Do not run research Phases 0\u20135",
    "Do not mutate archive/research or archive/outcomes history",
    "Do not edit app.css, run_detail.html, runs.html, or routes/pages.py",
    "Do not map phase_current to English",
    "Do not start Compare A/B labels or error.html nav.label"
  ],
  "work_type": "W4",
  "success_criteria": [
    "eng_verify.py passes",
    "Feature list items verified before passes=true"
  ],
  "write_allowlist": [
    "eng/",
    "packages/",
    "apps/",
    "programs/",
    "scripts/",
    "archive/library/"
  ],
  "write_denylist": [
    "archive/research/**",
    "archive/outcomes/**"
  ],
  "verify_commands": [
    "python3 scripts/eng_verify.py",
    "python3 -m pytest apps/analysis_web/tests -q"
  ]
}
